{
  "schemaVersion": "1.0.0",
  "id": "local",
  "displayName": "Local Development",
  "deploymentTarget": "compose-local",
  "secretsProvider": "local-env",
  "configProvider": "local-files",
  "approvalRequired": false,
  "requiredGates": [
    "registry-validation",
    "artifact-validation",
    "environment-validation",
    "health-check"
  ],
  "observabilityProfile": "local-standard",
  "rollbackPolicy": "immediate",
  "promotionPolicy": "none"
}
